mysql> CREATE DATABASE Lucky_Shrub;
Query OK, 1 row affected (0.02 sec)

mysql> USE Lucky_Shrub; 
Database changed
mysql> CREATE TABLE Orders (OrderID INT NOT NULL PRIMARY KEY, ClientID VARCHAR(10), ProductID VARCHAR(10), Quantity INT, Cost DECIMAL(6, 2));
Query OK, 0 rows affected (0.15 sec)

mysql> INSERT INTO Orders (OrderID, ClientID, ProductID, Quantity, Cost) VALUES (1, "Cl1", "P1", 10, 500), (2, "Cl2", "P2", 5, 100), (3, "Cl3", "P3", 20, 800), (4, "Cl4", "P4", 15, 150), (5, "Cl3", "P3", 10, 450), (6, "Cl2", "P2", 5, 800), (7, "Cl1", "P4", 22, 1200), (8, "Cl1", "P1", 15, 150);
Query OK, 8 rows affected (0.02 sec)
Records: 8  Duplicates: 0  Warnings: 0

mysql> select * from Orders;
+---------+----------+-----------+----------+---------+
| OrderID | ClientID | ProductID | Quantity | Cost    |
+---------+----------+-----------+----------+---------+
|       1 | Cl1      | P1        |       10 |  500.00 |
|       2 | Cl2      | P2        |        5 |  100.00 |
|       3 | Cl3      | P3        |       20 |  800.00 |
|       4 | Cl4      | P4        |       15 |  150.00 |
|       5 | Cl3      | P3        |       10 |  450.00 |
|       6 | Cl2      | P2        |        5 |  800.00 |
|       7 | Cl1      | P4        |       22 | 1200.00 |
|       8 | Cl1      | P1        |       15 |  150.00 |
+---------+----------+-----------+----------+---------+
8 rows in set (0.00 sec)

-- create the OrdersView Virtual table based on the Orders table. The table must include the following columns: Order ID, Quantity and Cost.
CREATE VIEW OrdersView AS SELECT OrderID, Quantity, Cost FROM Orders;
select * from OrdersView;
+---------+----------+---------+
| OrderID | Quantity | Cost    |
+---------+----------+---------+
|       1 |       10 |  500.00 |
|       2 |        5 |  100.00 |
|       3 |       20 |  800.00 |
|       4 |       15 |  150.00 |
|       5 |       10 |  450.00 |
|       6 |        5 |  800.00 |
|       7 |       22 | 1200.00 |
|       8 |       15 |  150.00 |
+---------+----------+---------+
8 rows in set (0.00 sec)
-- utilizes the ‘OrdersView’ virtual table to Update the base Orders table. In the UPDATE TABLE statement, change the cost to 200 where the order id equals 2
UPDATE OrdersView SET Cost = 200 WHERE OrderID = 2;
select * from OrdersView;
+---------+----------+---------+
| OrderID | Quantity | Cost    |
+---------+----------+---------+
|       1 |       10 |  500.00 |
|       2 |        5 |  200.00 |
|       3 |       20 |  800.00 |
|       4 |       15 |  150.00 |
|       5 |       10 |  450.00 |
|       6 |        5 |  800.00 |
|       7 |       22 | 1200.00 |
|       8 |       15 |  150.00 |
+---------+----------+---------+
8 rows in set (0.00 sec)
-- changes the name of the ‘OrdersView’ virtual table to ClientsOrdersView
RENAME TABLE OrdersView TO ClientsOrdersView;
Query OK, 0 rows affected (0.02 sec)

mysql> DROP VIEW ClientsOrdersView;
Query OK, 0 rows affected (0.02 sec)

mysql> 
